Response,Speaker,What is said1,GORDON,"Harvey Dent was needed. He was everything Gotham has been crying out for. He was...a hero. Not the hero we deserved - the hero we needed. Nothing less than a knight, shining...  "2,GORDON,But I knew Harvey Dent. I was...his friend. And it will be a very long time before someone inspires us the way he did. I believed in Harvey Dent.  3,CIA MAN,"Dr. Pavel, I'm CIA. Dr. Pavel nods, nervous. CIA Man hands the Driver a briefcase.  "4,DRIVER,"He wasn't alone. CIA Man, confused, spots the Hooded Men. He turns to Dr. Pavel.  "5,CIA MAN,You don't get to bring friends.  DR. PAVEL They are not my friends.  6,DRIVER,"Don't worry, no charge for them.  "7,CIA MAN,Why would I want them?  8,DRIVER,They were trying to grab your prize. They work for the mercenary. The masked man.  9,CIA MAN, Bane? The Driver nods. CIA Man turns to his Special Forces Men.  10,CIA MAN,Get 'em on board - I'll call it in.  11,CIA MAN,"What are you doing in the middle of my operation?  Hooded Man 1 says nothing. CIA Man pulls out a handgun. The flight plan I just filed with the Agency lists me, my men, and Dr. Pavel here. But only one of you. CIA Man opens the cargo door. Special Forces hang Hooded Man 1 out into the howling wind - CIA Man shouts above the wind.  "12,CIA MAN, 14,CIA MAN, HE DIDN'T FLY SO GOOD! WHO WANTS TO  15,CIA MAN, TELL ME ABOUT BANE! WHY DOES HE  WEAR THE MASK?!   The prisoner says nothing. CIA Man presses the gun to the man's hood - he cocks the gun...nothing.  16,CIA MAN, LOT OF LOYALTY FOR A HIRED GUN!    17,THIRD PRISONER,Or he's wondering why someone would shoot a man before throwing him out of an aeroplane.   CIA Man turns to the Third Prisoner. Shuts the cargo door.  18,CIA MAN,"Wiseguy, huh? At least you can talk. Who are you?    "19,THIRD PRISONER,"We are nothing. We are the dirt beneath your feet. And no one cared who I was until I put on the mask...   CIA Man, wary, approaches the Third Prisoner - pulls off his hood, revealing a dark mask with a breathing apparatus. The eyes behind it are cold. Still. This is Bane.        "20,BANE,Who we are does not matter. What matters is our plan.  21,CIA MAN,"If I pull this off, will you die?  "22,BANE,It would be extremely painful.    23,CIA MAN,You're a big guy -  24,BANE,For you.  25,CIA MAN,Was being caught part of your plan?  26,BANE,Of course. Dr. Pavel refused our offer in favor of yours. We had to know what he told you about us.  DR. PAVEL Nothing! I said nothing!  27,CIA MAN,Why not just ask him?  28,BANE,He would not have told us.  29,CIA MAN,You have methods.  30,BANE,"Him, I need healthy. You present no such problem. CIA Man laughs for the Special Forces' benefit. A heavy bass tone is rising. The Sergeant looks out the window.  "31,SERGEANT,Sir?  32,CIA MAN,"Well congratulations, you got yourselves caught. What's the next step of your master plan?  "33,BANE,Crashing this plane...  34,BANE,With no survivors. A Special Forces soldier spins around - an Armed Man is outside the window. Bang -  35,BANE,"Friend. They expect one of us in the wreckage. The man nods, unhooks himself, takes Bane's arm.    HOODED MAN 2 Have we started the fire?  "36,BANE,The fire rises.  37,BANE,"Calm, Doctor. Now is not time for fear... Bane slides Dr. Pavel out of his seat. They hang in the vertical, windblown cabin. Bane takes out a detonator.  "38,BANE,"That comes later. Bane presses the detonator - the cabin drops from around them, revealing the terrifying drop to the peaks below. Dr. Pavel screams as they are hoisted up towards the transport, and we -  "39,MAYOR,Harvey Dent Day may not be our oldest public holiday... ...moving past the enormous Gotham Bridge...  40,MAYOR,But we're here tonight because it's one of the most important... ...over the Gotham river to the Palisades on the far side...  41,MAYOR,"Harvey Dent's uncompromising stand against organized crime and, yes, ultimately, his sacrifice, have made Gotham a safer place than it was at the time of his death, eight years ago... ...finding a party in the grounds of Wayne Manor. The Mayor addresses the wealthy and powerful of Gotham.  "42,MAYOR,"This city has seen a historic turnaround. No city is without crime. But this city is without organized crime because the Dent Act gave law enforcement teeth in its fight against the mob. Now people are talking about repealing the Dent Act. And to them I say...not on my watch. Enthusiastic applause as the Mayor wraps up. I want to thank the Wayne Foundation for hosting this event. I'm told Mr. Wayne couldn't be here tonight, but I'm sure he's with us in spirit...   High above, on a darkened balcony, a lone figure. Watching.  "43,MAYOR,"Now I'm going to give way to an important voice...   Down below at the bar, Commissioner Gordon examines some sheets of densely written paper. A Congressman muscles in.  "44,CONGRESSMAN,Commissioner.  45,GORDON,Congressman.  46,CONGRESSMAN,"Ever lay eyes on Wayne at one of these things? Gordon shakes his head. Gordon's Deputy Commissioner, Foley, cuts in.  "47,FOLEY,No one has. Not in years.  48,MAYOR,"He can tell you about the bad old days, when the criminals and corrupt ran this town with such a tight grasp that people put their faith in a murderous thug in a mask and a cape. A thug who showed his true nature when he betrayed the trust of this great man -  And murdered him in cold blood. The Congressman watches a tray of canapes breeze past, then grabs the ass of the maid carrying them. She freezes.    "49,CONGRESSMAN,"Sweetheart, not so fast with the chow.  "50,MAID,Shrimp balls? The Congressman grabs two. The Maid moves off. The Congressman glances down at Gordon's papers.    51,MAYOR,Jim Gordon can tell you the truth about Harvey Dent...  52,CONGRESSMAN,"Jesus, Gordon, is that your speech? We're gonna be here all night.  "53,GORDON,"Maybe the truth about Harvey isn't so simple, Congressman.    "54,MAYOR,But I'll let him tell you himself - Commissioner Gordon? Applause. Gordon approaches the mike. Looks down at his long speech. Thinks.  55,GORDON,The truth...? 56,CONGRESSMAN,Thank Christ for that...  57,GORDON,"Maybe right now all you need to know is that there are a thousand inmates in Blackgate Prison as a direct result of the Dent Act. These are violent criminals, essential cogs in the organized crime machine that terrorized Gotham for so long. Maybe, for now, all I should say about Harvey Dent's death is this...it has not been for nothing. The figure on the balcony turns back into the mansion. People clap as Gordon leaves the mike. Gordon approaches Foley.    "58,GORDON,The second shift reports in?  59,FOLEY,On your desk. But you should put in some more time with the Mayor -  60,GORDON,That's your department.   Gordon heads for the line of town cars in the gravel drive.  61,CONGRESSMAN,Anyone shown him the crime stats?  62,FOLEY,"He goes by his gut, and it continues to bother him, whatever the numbers.  "63,CONGRESSMAN,Must be popular with the wife.   64,FOLEY,Not really. She took the kids and moved to Cleveland.  65,CONGRESSMAN,He'll have plenty of time for visits. Mayor's dumping him in the spring.  66,FOLEY,Really? He's a hero.    67,CONGRESSMAN,"War hero. This is peacetime. Stay smart, the job's yours.      "68,ALFRED,"Mr. Till, why are your people using the main stairs? Alfred places a glass of water on a tray next to a covered plate. Picks up the tray, looks around the chaotic kitchen.    "69,ALFRED,Where's Mrs. Bolton?  70,MAID,"She's up at the bar, sir. Can I help?   Alfred looks at the Maid. Hands her a key and the tray.  "71,ALFRED,"The East drawing room. Unlock the door, place the tray on the table, lock the door again. Nothing more.   The Maid nods. Takes the tray.    "72,ALFRED,"I'm sorry, Miss Tate, but I've tried. He won't see you.    "73,MIRANDA,"It's important, Mr. Pennyworth. Her accent is European. Hard to place.  "74,ALFRED,"Mr. Wayne is as determined to ignore important things as trivial ones.  MALE VOICE Don't take it personally, Miranda.   They turn to see a man in his fifties. Daggett.  "75,DAGGETT,"Everyone knows Wayne's holed up in there with eight-inch nails, peeing into Mason jars. Good of you to let me on the grounds.  "76,ALFRED,"The Dent Act is about all Gotham. Even you, Mr. Daggett. Miss Tate, always a pleasure. Alfred turns and walks off. Daggett smiles, glib.      "77,DAGGETT,Why waste your time talking to the man who threw away your investment on some save-the-world vanity project? He can't help you get your money back. But I can.  78,MIRANDA,"I could try explaining that a save-the-world project, vain or not, is worth investing in, whatever the return. I could try, Mr. Daggett, but you understand only money and the power you think it buys, so why waste my time, indeed?   She walks away. Daggett watches her go.    "79,MAID,"I'm, I'm terribly sorry, Mr. Wayne. It is Mr. Wayne, isn't it?   Wayne nods, gently. Limps towards her.  "80,MAID,"Although you don't have the long nails... Or facial scars... She trails off, embarrassed. Coy. She seems very young.  "81,WAYNE,Is that what they say about me?   82,MAID,It's just that...nobody sees you...   Wayne approaches slowly. He nods at her pearl necklace.  83,WAYNE,"That's a beautiful necklace. Reminds me of the one that belonged to my mother. It can't be the same one - her pearls are in this safe - He reaches out with his cane to press open a panel on the bureau, revealing a safe door... - which the manufacturer clearly explained is uncrackable.   ...which swings open with an awkward creak.  "84,MAID,Oops. No one told me it was uncrackable.   The Maid suddenly seems more confident. Older.  85,WAYNE,I'm afraid I can't let you take those.   She smiles at him. Moves towards him.  86,MAID,"Look, you wouldn't hit a woman any more than I would beat up a cripple. She kicks his cane from under him, smashes him down. Of course, sometimes exceptions have to be made.   The Maid vaults onto the bureau and up to a high window. Goodnight, Mr. Wayne. She flips backwards through the window. Wayne smiles, then rocks forward on his good leg and rises with athletic grace. He looks at the safe, notices something. Powder...    "87,MAID,"Can I have a ride? The Congressman, a little tipsy, looks at her hungrily.  "88,CONGRESSMAN,You read my mind.    89,ALFRED,Miss Tate was asking to see you again.    90,WAYNE,She's very persistent.  91,ALFRED,"And quite lovely, in case you were wondering.    "92,WAYNE,I wasn't.  93,ALFRED,What are you doing?    94,WAYNE,Examining print dust. We've been robbed.  95,ALFRED,And this is your idea of raising the alarm?  96,WAYNE, She took the pearls. Tracking device and all.  97,ALFRED,She?  98,WAYNE,"One of the maids, perhaps you should stop letting them in this side of the house.  "99,ALFRED,"Perhaps you should learn to make your own bed, then. Why are you dusting for prints?  "100,WAYNE,I'm not. She was.  YOUNG VOICE Sir?  101,BLAKE,"I didn't want to bother you up here, but they're looking for you.  "102,GORDON,"What's the problem, son?  "103,BLAKE,Congressman Gilly's wife's been calling. He hasn't made it home from the Wayne Foundation event.  104,GORDON,That's a job for the police?  105,BLAKE,"Sir, I've been a cop for a year and I've only logged half a dozen arrests. When you and Dent cleaned the streets you cleaned 'em good. Pretty soon we'll be chasing overdue library books. Gordon smiles at this. Blake looks at his stack of files.  "106,BLAKE,But here you are. Like we're still at war...  107,GORDON,Old habits.  108,BLAKE,Or instinct.  109,GORDON,"What's your name, son?  "110,BLAKE,"Blake, sir.  "111,GORDON,"You have something you want to ask me, Officer Blake?  "112,BLAKE,"It's that night. This night, eight years ago. The night Dent died.  "113,GORDON,What about it?  114,BLAKE,"The last confirmed sighting of the Batman. He murders those people, takes out two SWAT teams, breaks Dent's neck...then just vanishes?  "115,GORDON,"I'm not hearing a question, son.  "116,BLAKE,Don't you want to know who we was? Gordon turns to look at the broken searchlight. He brushes his fingers across its rusted shell.  117,GORDON,I know exactly who he was. He was Batman.  118,GORDON,Let's go see about the Congressman's wife...  119,ALFRED,Master Wayne? Alfred's voice echoes through the vast mansion. No reply.  120,ALFRED,You haven't been down here in a long time...  121,WAYNE,"Just trying to find out more about our jewel thief. I ran her prints from the photos she handled - Wayne pulls up a mug shot - a fat, male armed-robbery suspect. - but she was wearing someone else's fingerprints. She's good.  "122,ALFRED,She may be. But we have the trace on the necklace.  123,WAYNE,"We do, so I cross-referenced the address she went back to with police data on high-end B-and-E's...  "124,WAYNE,"She's good, but the ground is shrinking beneath her feet.  "125,ALFRED,We should send the police before she fences the pearls.  126,WAYNE,She won't. She likes them too much. And they weren't what she was after.  127,ALFRED,What was she after?    128,WAYNE,"My fingerprints. There was printer toner mixed with graphite on the safe. Gives you a good pull, and it's untraceable.  "129,ALFRED,Fascinating. Maybe you should exchange notes over coffee.  130,WAYNE,Now you're trying to set me up with a jewel thief?  131,ALFRED,"At this point, sir, I would set you up with a chimpanzee if I thought it would bring you back into the world.  "132,WAYNE,There's nothing out there for me.  133,ALFRED,"And that's the problem. You hung up the cape and cowl, but never moved on. You won't get out there and find a life. Find someone  "134,WAYNE,"I did find someone, Alfred.  "135,ALFRED,"I know. And then you lost them. That's part of living, sir. But you're not living - you're waiting. Hoping for things to go bad again.   Wayne says nothing. Remember when you left Gotham? Before all this. Before Batman. Seven years you were gone. Seven years I waited. Hoping that you wouldn't come back. Wayne looks at Alfred. Not understanding. Every year I took my holiday. I'd go to Florence. There's a cafe by the Arno... Any fine evening I would sit there and order a Fernet Branca... "136,DWP MAN,"They wash up a couple times a month. More when in gets colder - homeless sheltering in the tunnels. We had to pull him to clear the basin, but other than that we didn't touch him...   "137,ROSS,What?  138,BLAKE,Name's Jimmy. He's at St. 139,FATHER REILLY,Jimmy hadn't been here for months.  140,BLAKE,Why?  141,FATHER REILLY,"You know why, Blake - he aged out. We don't have the resources to keep boys on after sixteen -  "142,BLAKE,The Wayne Foundation gives money for that -  143,FATHER REILLY,Not for two years now.  144,BLAKE,"He has a brother here, right?  "145,FATHER REILLY,Mark. I'll tell him.  146,BLAKE,"I'd like to, if that's okay.  "147,BLAKE,I'm sorry.  148,BLAKE,What was he doing in the tunnels?  149,MARK,Lot of guys been going down the tunnels when they age out. Say you can live down there. Say there's work down there.  150,BLAKE,What kind of work are you gonna find in the sewers?  151,MARK,"More than you can find up here, I guess. Blake considers this. Troubled.  "152,STRYVER,You brought a date?  153,SELINA,I like having someone around to open doors for me.   154,SELINA,Right hand. No partials. Stryver slides a transparency out of the envelope. Holds it up to the light. Four perfect fingerprint transfers.  155,STRYVER,Very nice. He pockets the envelope.  156,SELINA,"Not so fast, handsome. You got something for me?  "157,STRYVER,"Oh, yes.  "158,SELINA,I don't know what you're going to do with Mr. Wayne's prints...but I'm guessing you'll need his thumb. As Stryver checks the envelope again -  159,SELINA,"You don't count so good, huh?  "160,STRYVER,I count fine. The Second Thug puts a gun to Selina's head.  161,STRYVER,"In fact, I'm counting to ten right now... Selina looks in his eyes. The Thug cocks his gun. She blinks.  "162,SELINA,"Okay, okay -  She reaches for her purse. The Thug stops her, reaches in himself - pulls out a cellphone. Slides it across the table.  "163,SELINA,My friend is waiting outside. Just hit 'send'...  164,JEN,Place is a little dead.  165,SELINA,"It'll liven up in a minute, trust me.  "166,JEN,Everything okay?  167,SELINA,Great. Catch you later. Jen leaves. Stryver checks the envelope. Satisfied.  168,SELINA,It would've been a lot easier to just give me what we agreed.  169,STRYVER,"We can't have loose ends. And even in that dress, no one's going to miss you.  "170,SELINA,No. But my friend over there...? Stryver looks at Selina's 'date' drooling into a bowl of nuts at the bar - he looks familiar...  171,SELINA,Every cop in the city's missing him.  172,STRYVER,Cute. But they're not gonna be looking in a place like this.  173,SELINA,I don't know... You did just use his cell phone.  174,SWAT,"It's alright, Miss. Just stay down  - The SWATs barrel past, chasing the remaining Thugs back through the bar and out into the back alley. Selina smiles.  "175,SELINA,"Keep some pressure on that, sweetheart. She adjusts her dress in the broken mirror behind the bar. Moves for the door.    "176,CONGRESSMAN,Call me?  177,SELINA,There's a man in there - he's bleeding!  178,BLAKE,"It's okay, Miss. It's okay.  "179,BLAKE,"I've got the Congressman - bullet to the leg, but he's okay.  "180,GORDON,Manhole!  181,GORDON,"You three, down with me. You two, head down to cover the next exit -    "182,SWAT,Where -?  183,GORDON,"Get the DWP down here, now!   Gordon starts climbing down the ladder...    "184,COP,Where's the DWP guy?    185,BLAKE,They went down there?  186,FOLEY,And Gordon took SWAT in after them.    187,BLAKE,"Come on, we gotta get down there -    "188,COP,"That was a gas explosion, kid -  "189,BLAKE,Gas? This is a sewer!  190,FOLEY,No one goes in there till we know what's down there.  28.      191,BLAKE,"We know what's down there, sir. The Police Commissioner!  "192,FOLEY,Somebody get the hothead out of here. And get me a DWP guy! Blake backs off. Gets an idea - goes for his patrol car.      193,BANE,Why are you here? The Thugs drop Gordon at Bane's feet.    THUG 1 Answer him! Bane slowly turns to the Thugs.     194,BANE,I'm asking you.  THUG 1 It's the Police Commissioner.    195,BANE,And you brought him down here?  THUG 2 We didn't know what to do. We -    196,BANE,"You panicked. And your weakness costs three lives.  THUG 1 No, he's alone - Bane flips the Thug's chin up and to the side with a crack. Thug 1 drops. Bane turns to Thug 2.  "197,BANE,"Search him. Then I will kill you. The Thug, terrified, pulls out Gordon's badge, wallet, gun...and the folded papers of the speech he did not read. Bane takes these one by one with quick glances. He stops at the papers. Unfolds them...   As he reads, Gordon rolls off the steps, dropping into the rushing flow of water - gunshots ring out...  THUG 2 He's dead.   Thug 2 trails off as Bane looks up from the papers...  "198,BANE,Then show me his body.    THUG 2 That water runs to any one of the outflows - we'd never find him. Bane turns to the Lead Mercenary.    199,BANE,"Give me your GPS. Lead Mercenary hands him a GPS - Bane tucks it into Thug 2's jacket, zips it up like a mother sending her kid to school.      "200,BANE,"Follow him.  THUG 2 Follow him?   Bane shoots Thug 2, kicks him into the water. Turns to Lead Mercenary.  "201,BANE,Track him. Make sure both bodies will not be found. Then brick up the south tunnel.    202,BLAKE,I need to see Bruce Wayne.    203,ALFRED,"I'm sorry, Mr. Wayne doesn't take unscheduled calls. Even from police officers.    "204,BLAKE,"And if I go get a warrant, in the investigation of Harvey Dent's murder? Would that still count as unscheduled?      "205,WAYNE,"What can I do for you, officer?  "206,BLAKE,Commissioner Gordon's been shot.    207,WAYNE,I'm sorry to hear that -  208,BLAKE,He chased a gunman down into the sewers. When I pulled him out he was babbling about an underground army. A masked man called 'Bane'.  209,WAYNE,Shouldn't you be telling this to your superior officers?  210,BLAKE,I did. One of them asked if he saw any giant alligators down there. He needs you. He needs the Batman.    211,WAYNE,If Commissioner Gordon thinks I'm the Batman he must be in a bad way  -    212,BLAKE,"He doesn't know or care who you are.  But we've met before. When I was a kid. At the orphanage. See, my mom died when I was small. Car accident, I don't really remember it. But a couple of years later my dad was shot over a gambling debt. I remember that just fine.  Not a lot of people who know what it feels like, do they? To be angry. In your bones. People understand, foster parents understand. For a while. Then they expect the angry kid to do what he knows he can never do. To move on. To forget.   Wayne stares at Blake.  "213,BLAKE,"So they stopped understanding and sent the angry kid to a boys' home - St. Swithin's. Used to be funded by the Wayne Foundation. See, I figured it out too late. You have to hide the anger. Practice smiling in the mirror. Like putting on a mask. You showed up one day in a cool car, pretty girl on your arm.       "214,BLAKE,"We were so excited - Bruce Wayne, billionaire orphan. We made up stories about you. Legends. The other boys' stories were just that. But when I saw you I knew who you really were... I'd seen that look on your face. Same one I taught myself. Blake gets up to leave. Wayne is lost in thought.    "215,BLAKE,"I don't know why you took the fall for Dent's murder, but I'm still a believer in the Batman. Even if you're not.    "216,WAYNE,Why did you say your boys' home used to be funded by the Wayne Foundation?    217,BLAKE,Because the money stopped. Might be time to get some fresh air and start paying attention to the details. Some of those details might need your help.    218,WAYNE,You checked that name? 'Bane' -  219,ALFRED,Ran it through some databases. He's a mercenary. No other known name. Never been seen or photographed without a mask. He and his men were behind a coup in West Africa that secured mining operations for our friend John Daggett.    220,WAYNE,Now Daggett's brought them here?  221,ALFRED,It would seem so. I'll keep digging.    Alfred turns to leave.  222,WAYNE,Why did the Wayne Foundation stop funding boys' homes in the city?    223,ALFRED,The Foundation is funded from the profits of Wayne Enterprises... There have to be some.    224,WAYNE,"Time to talk to Mr. Fox, I think.  "225,ALFRED,I'll get him on the phone -    226,WAYNE,No. Do we still have any cars around the place?  227,ALFRED,One or two.  228,WAYNE,And I need an appointment at the hospital. About my leg.    229,ALFRED,"Which hospital, sir?  "230,WAYNE,Whichever one Jim Gordon's in.   Alfred is less excited by this part of the request.    231,MIRANDA,"Mr. Fox, I believe in what Mr. Wayne was trying to do...      "232,MIRANDA,I'm only asking for explanations because I think I can help.  233,FOX,I'll pass along your request. Next time I see him. Miranda catches something in this.  234,MIRANDA,He doesn't talk to you either?  235,FOX,Let's just say that Bruce Wayne has his...eccentricities.  236,MIRANDA,"Mr. Fox, are you aware that John Daggett is trying to acquire shares in Wayne Enterprises?  "237,FOX,I was not. But it wouldn't do him any good - Mr. Wayne still retains a clear majority. Miranda leaves. Fox moves into his office - stops.  238,FOX,"Bruce Wayne. As I live and breathe. Wayne rises, pushing hard on his cane.  "239,FOX,What brings you out of cryo-sleep Mr. Wayne?  240,WAYNE,I see you haven't lost your sense of humor...even if you have lost most of my money.  241,FOX,"Actually, you did that yourself. See, if you funnel the entire R and D budget for five years into a fusion project that you then mothball, your company is unlikely to thrive.  "242,WAYNE,Even with -  243,FOX,"A wildly sophisticated CEO, yes. Wayne Enterprises is running out of time. And Daggett is moving in.  "244,WAYNE,What're my options?  245,FOX,If you're not willing to turn your machine on -  246,WAYNE,"I can't, Lucius.  "247,FOX,"Then sit tight. Your majority keeps Daggett at arm's length while we figure out a future for the energy program with Miranda Tate - she's supported your project all the way. She's smart, and quite lovely.  "248,WAYNE,"You too, Lucius?  "249,FOX,"We all just want what's best for you, Bruce. Show her the machine.  "250,WAYNE,I'll think it over.  251,FOX,Anything else?  252,WAYNE,"No, why?  "253,FOX,These conversations always used to end with some...unusual requests.  254,WAYNE,I retired.  255,FOX,"Let me show you some stuff, anyway. Fox hits a button - the bookcase opens into a hidden elevator.  "256,WAYNE,I figured you'd have shut this place down.  257,FOX,"It was always shut down, officially.  "258,WAYNE,But all this new stuff?  259,FOX,"After your father died, Wayne Enterprises set up fourteen different defense subsidiaries. I've spent years shuttering them and consolidating all the prototypes under one roof. My roof.  "260,WAYNE,Why?  261,FOX,"Stop them falling into the wrong hands. Besides, I thought someone might get some use out of them... Wayne shakes his head.  "262,FOX,Sure I can't tempt you to something? Pneumatic crampons? Infrared lenses? Least let me get you something for that leg.  263,WAYNE,It's fine the use it gets these days.  