Response,Speaker,What is said828,BLAKE,"Your hands look pretty filthy to me, Commissioner.   Gordon stares at him. Blake goes back to packing.    "829,BANE,"We take Gotham from the corrupt. The rich. The oppressors of generations who've kept you down with the myth of opportunity. And we give it to you, the people. Gotham is yours - none shall interfere. Do as you please...   The Tumbler fires, blowing the doors to hell.   "830,BANE,"But start by storming Blackgate and freeing the oppressed... Step forward, those who would serve...   Bane's men surge through the burning gates...    "831,BANE,For an army will be raised... Mercenaries hand out weapons to escaping Prisoners...      832,BANE,The powerful will be ripped from their decadent nests...      833,BANE,...and cast into the cold world the rest of us have known and endured...    834,BANE,Courts will be convened...      835,BANE,The spoils will be enjoyed...    836,BANE,Blood will be shed...   837,BANE,"But the police will live, until they are ready to serve true justice...      "838,BANE,This great city will endure... Close enough to see the flickering digits of its countdown...  839,BANE,Gotham will survive. Mercenaries load the core into the back of a black truck.    840,PRISONER,"He says you must first straighten your back. The Prisoner helps Wayne roll over, painfully.    "841,WAYNE,How would he know?  842,PRISONER,He was the prison doctor. A morphine addict who incurred the displeasure of powerful people. Including your masked friend.  843,WAYNE,How?  844,PRISONER,"Many years ago, during a time of plague, Bane was attacked by other prisoners. The doctor's fumbling attempts to repair the damage left him in perpetual agony. The mask holds his pain at bay.  "845,WAYNE,Is Bane the child you spoke of? Was he born here?    846,PRISONER,The legend is that there was a mercenary working for the local warlord who fell in love with his daughter. They married in secret.   The Prisoner takes a rope - ties it under Wayne's arms.  847,PRISONER,"When the warlord found out, he condemned the mercenary to this pit. But then exiled him instead. "848,PRISONER,"The mercenary understood that the warlord's daughter had secured his release, but he couldn't know the true price of his freedom. She had taken his place in the pit.   "849,PRISONER,And she was with the child. The mercenary's child.   850,PRISONER,One day the doctor forgot the lock the cell... 851,PRISONER,Innocence cannot flower underground. It was to be stamped out. But the child had a friend. A protector...   852,PRISONER,...who showed the others that this innocence was their redemption. The mother was not so lucky. The Blind Prisoner shouts at the Prisoner. He nods.    853,PRISONER,This is Bane's prison now. Bane would not want this story told. The Prisoner pulls - Wayne screams in pain as he is pulled upright. The Prisoner ties him off. Checks his spine. You have a protruding vertebra...I'm going to force it back...  854,WAYNE,"How -?   The Prisoner punches Wayne in the back, hard. Wayne screams.  "855,PRISONER,"You stay like this. Until you stand.   Wayne passes out from the pain and we FADE TO BLACK. Wayne is hanging in his cell, delirious.   "856,R¯'S AL GH¯L, 857,A U,"Did you not think I'd return, Bruce? R¯'s al Gh¯l, in his Ducard guise, steps in front of Wayne.  "858,A U,   859,R¯'S AL GH¯L, 860,A U,I told you I was immortal.  861,WAYNE,I watched you die.    862,R¯'S AL GH¯L, 863,A U,"There are many forms of immortality. Wayne looks inward, remembering...   "864,A, 865,R¯'S AL GH¯L, 866,A U,Once I had a wife. My great love. She was taken from me...   867,A, 868,WAYNE,You were the mercenary. Bane is your child. Your heir. 869,A, 870,R¯'S AL GH¯L, 871,A U,An heir to ensure the League of Shadows fulfills its duty to restore balance to civilization.  872,WAYNE,No...  873,R¯'S AL GH¯L, 874,A U,"You yourself fought the decadence of Gotham for years. With all your strength and resources, all your moral authority. And the only victory you could achieve was a lie. Finally you understand... Gotham is beyond saving...  "875,WAYNE, NO!  876,R¯'S AL GH¯L, 877,A U,And must be allowed to die. CUT TO WHITE. And we are -      878,BLAKE,For the bus in case there's a chance to evacuate. Keep it in here - people are siphoning parked cars.    879,FATHER REILLY,Really?  880,BLAKE, 881,FATHER REILLY,Right. Any news? Is the  COMMISSIONER -    882,BLAKE,"Less you know, Father. How're the boys?    "883,FATHER REILLY,"Power's been on more, so they get some TV.   Blake smiles. Moves to the door. Blake, you be careful out there. They're hunting down cops like dogs.   Blake nods. Leaves.    "884,JEN,Who's that?    885,SELINA,This was someone's home.  886,JEN,Now it's everyone's home.   Selina stares out at a Tumbler rolling by.  887,JEN,"'Storm's coming', remember? This is what you wanted.    "888,SELINA,No. It's what I thought I wanted.    889,PRISONER,Why build yourself?    890,WAYNE,I'm not meant to die in here. The Prisoner indicates the TV:    SIEGE OF GOTHAM: DAY 84.  891,PRISONER,Here? There? What's the difference? Wayne ignores this. Focuses on his body...      892,PRISONER,I told you it could not be done.  893,WAYNE,You told me a child did it...    894,PRISONER,No ordinary child... 895,FOLEY,You have ID?  SPECIAL FORCES 1 Of course not.    896,FOLEY,How can we trust you?  897,GORDON,"We don't have any choice.   Gordon and Blake emerge from the back of the room.  SPECIAL FORCES 1 Commissioner Gordon? Captain Jones, Special Forces.    "898,GORDON,"Captain, glad to have you here.    "899,CAPTAIN JONES,How many of you are there?  900,GORDON,Dozens. I'd rather not say exactly. But the men trapped underground number almost three thousand.  901,CAPTAIN JONES,What kind of shape they're in?    902,GORDON,"They've been getting water, food.  "903,CAPTAIN JONES,Could we break them out?    904,BLAKE,"Yes, sir - take out the mercenaries guarding the outflow south of Ackerman Park, blow the rubble, you've got a hole big enough for ten at a time. I'm in contact with my partner - they're waiting for the day.  SPECIAL FORCES 2 Men who haven't seen daylight for three months?    "905,BLAKE,Men with automatic weapons who haven't seen daylight in three months.    906,CAPTAIN JONES,What about the bomb? The satellites can't see any radiation hot spots...      907,GORDON,They keep it on a truck - it must have a lead-lined roof. They move it constantly.  908,CAPTAIN JONES,But you know the truck?    909,GORDON,"They've got three of them. The routes don't vary much. Two Tumblers lead a massive black truck down the street. Captain Jones reaches into his jacket and triggers a Geiger counter. Shows Blake the display. Nods. One of the Tumblers stops, turns back. Blake leads them down a side street.    "910,CAPTAIN JONES,What about the triggerman?  911,GORDON,No leads. It's a bluff - Bane wouldn't give control of that bomb to someone else.  912,CAPTAIN JONES,"We can't take that chance. Until we have the triggerman, we just track the device, smuggle men over -  "913,BLAKE,"While Gotham lives under a warlord, like in some failed state?    "914,CAPTAIN JONES,"Dial it back, officer. This situation is unprecedented. We can't do anything to risk millions of lives.    "915,BLAKE, 916,GORDON,"Captain, things are more complicated than you think. There's somebody you need to meet. Blake? Blake nods, leads Jones and his men up the stairs.      "917,BLAKE,I was up here looking for a vantage point. Found the people who run the corporation who owns it living here.  918,CAPTAIN JONES,Which corporation?  919,FOX,"Wayne Enterprises. Lucius Fox is there, with Miranda Tate.    "920,BLAKE,"Captain, meet Mr. Fox. Mr. Fox, I'd like you to brief the Captain. Captain Jones indicates Miranda.    "921,FOX,Miss Tate is fully aware of the situation.  922,MIRANDA,"And as CEO of Wayne Enterprises, I have to take responsibility for it.  "923,CAPTAIN JONES,Why?    924,MIRANDA,"Because, Captain, we built it.  "925,CAPTAIN JONES,You built the bomb?    926,FOX,"It was built as a fusion reactor. The first of its kind. Bane turned the core into a bomb, then disconnected it from the reactor.     "927,BLAKE,And here's the important part.  928,FOX,"As the device's fuel cells decay, it's becoming increasingly unstable...until the point of detonation.  "929,BLAKE,The bomb's a time bomb.    930,FOX,And it will go off. In twenty-three days. Captain Jones reels at this news.    931,BLAKE,Bane's revolution is a sham. He's watching Gotham rearrange its deckchairs while the whole ship's going down. Your appeasement plan might not be as practical as you thought. Captain Jones throws Blake a look. Addresses Fox.  932,CAPTAIN JONES,Could you disarm it?  933,FOX,"I don't know, But I could reconnect it to the reactor. Stabilize it.    "934,CAPTAIN JONES,We'd have to let the Pentagon know.  SPECIAL FORCES 2 They'll be monitoring our  FREQUENCIES -  935,CAPTAIN JONES,"We have no choice. Let's move away from this location, then call it in.      "936,BLAKE,"Fox, somebody sold us out! Fox and Miranda burst into the corridor.    "937,FOX,"Take Miranda - Blake grabs Miranda, heads for the back stairs. Mercenaries jump out of the elevator, firing high.    "938,MERCERNARY, DOWN ON THE FLOOR! Fox freezes. Lowers himself to the ground.      939,CAPTAIN JONES,I'll die before I talk...  940,BANE,"I'm on your schedule, Captain.   Bane places his hand over Jones's nose and mouth.  "941,MERCERNARY,"There were people living upstairs.   Bane looks up, disinterested. Jones is dead.  "942,BANE,Give them over for judgement. 943,PRISONER,He says the leap to freedom is not about strength.    944,WAYNE,My body makes the jump.  945,BLIND PRISONER, 946,WAYNE,My soul's as ready to escape as my body.    947,BLIND PRISONER,Fear is why you fail.  948,WAYNE,I'm not afraid. I'm angry.   Wayne throws punches...focused.    949,SKINNY PRISONER,"Shouldn't you get him down? The Prisoner glances up at Wayne, disdainful.    "950,PRISONER,He'll keep. As Wayne drifts into unconsciousness we - 951,THOMAS WAYNE,And why do we fall?      952,BLIND PRISONER, 953,WAYNE,Why?  954,BLIND PRISONER,How can you move faster then possible? Fight longer than possible? If not from the most powerful impulse of the spirit. The fear of death. The will to survive. Wayne gets up onto his elbow. Looks at the Blind Prisoner.  955,WAYNE,I do fear death. I fear dying in here while my city burns with no one there to save it.  956,BLIND PRISONER,Then make the climb.  957,WAYNE,How?  958,BLIND PRISONER,As the child did. Without the rope. 959,PRISONER,"Supplies for your journey? Prisoners nearby laugh. Wayne moves to the cliff face. The Prisoner follows, intrigued by Wayne's new demeanor. The Tattooed Prisoner offers him the rope. Wayne refuses. Starts to climb. Prisoners gather around as word spreads. Wayne makes his way cautiously up the treacherous rock face. Down below the Prisoners start a low chant. As Wayne hoists himself up onto the precipice something EXPLODES from the cliff face. Wayne flinches - BATS... They circle up to the opening above... Wayne closes his eyes. The chant RISES. Wayne takes a breath...opens his eyes...looks down at the drop...up again...then he jumps.   Time skips a beat as the Prisoners stop breathing. And Wayne GRABS the ledge above. The Prisoners go WILD as Wayne hoists himself up onto the ledge. The Blind Prisoner nods. Wayne climbs to FREEDOM.      "960,STRYVER,I want to see Bane! There's been a mistake! Take me to Bane! Fox watches him dragged upstairs...   961,STRYVER,"There's been a mistake! Where's Bane?!  VOICE There's been no mistake, Mr. Stryver.   Stryver turns to look at the 'judge': Dr. Jonathan Crane.  "962,CRANE,"You are Philip Stryver, executive vice-president of Daggett "963,STRYVER,"Call Bane! I'm one of you! Jeers. Pull back to reveal a silent figure, watching. Bane.  "964,CRANE,"Bane has no authority here. This is merely a sentencing hearing. The choice is yours, death or exile. Stryver looks around, terrified, as the crowd shouts 'Death'.    "965,STRYVER,Exile.  966,CRANE, 967,BLACKGATE INMATE,Follow the tick ice. Try to swim - you're dead in minutes.  968,STRYVER,"Has anyone made it? The Blackgate Inmate turns away. Stryver is forced onto the ice. He shuffles forward, listening to the creaking... Stryver is a hundred yards out when the river swallows him.      "969,GORDON,"Where the hell are they? It's not like we have a lot of time, here.  "970,COP,How long?  971,GORDON,The bomb goes off tomorrow. We've got about eighteen hours to do something.    972,COP,To do what?  973,GORDON,"We mark that truck. Get a GPS on it, then we can start thinking about how to take it down. The door opens and Blake enters, followed by ten cops. Gordon is counting them in. He moves to Blake.    "974,GORDON, 975,GORDON,"Foley. Where's Foley, dammit?! Gordon heads for the door.    "976,BLAKE,You shouldn't be out on the streets  -      977,FOLEY'S WIFE,"Jim. He's not here -   Gordon, furious, addresses the hallway behind her.  "978,GORDON,You're sending your wife to the door when the city's under occupation?! Foley appears at the end of the corridor. Ashamed.  979,FOLEY,"Wait in the kitchen, honey.    "980,GORDON,"What did you do, bury your uniform in the backyard?  "981,FOLEY,"Jim, you saw what they did to those Special Forces.  "982,GORDON,You forgotten all the years we went out on patrol with every gangbanger wanting to plant one as soon as our backs were turned?  983,FOLEY,This is different and you know it. These guys run the city - the government's done a deal with them  -  984,GORDON,Deal?! Bane's got their balls in a vice. That's not a deal -  985,FOLEY,"You move against Bane, the triggerman's gonna hit the button -  "986,GORDON,You think he's given control of that bomb to one of 'the people'?! You think this is part of some revolution? There's one man with his finger on the button - Bane.  987,FOLEY,We have to keep our heads down until they can fix this. If you still had family here maybe you'd -    988,GORDON,This only gets fixed from inside 989,FOLEY,I'm sorry Jim. I gotta -  990,GORDON,"Keep your head down? What's that gonna do tomorrow, when that thing blows?  "991,FOLEY,You don't know that's going to happen. Foley closes the door on Gordon. Gordon stands there.  992,MIRANDA,"I hear you're looking for men, Commissioner. Gordon turns to see Miranda, Blake behind her. Blake shrugs.  "993,MIRANDA,"How about me, instead?  "994,GORDON,"Miss Tate, I can't ask you -  "995,MIRANDA,My company built it.  996,GORDON,Bruce Wayne built it.  997,MIRANDA,And he wanted to destroy it. It was me who didn't listen. Please. Gordon looks at Blake. Then Miranda. Nods.  998,GORDON,Let's go.  999,GANGBANGER,"You steal from us, you little bastard? They grab the Kid's backpack, the Gangbanger pulls out an apple, moves to hit the Kid when - SMACK! - his hand is grabbed, and the apple flies into the air as his arm cracks. Selina catches the apple.    "1000,SELINA,"You boys know you can't come into my neighborhood without asking politely.   Gangbanger 2 lunges with a knife - she spins him, making him stab himself in the backside. The Gangbangers run off, howling. The Kid eyes her, wary.  "1001,SELINA,"Never steal anything from someone you can't outrun, kid.  "1002,KID,Now you're gonna take it.   Selina looks at the red apple. Takes one perfect bite.  1003,SELINA,Just tax. She tosses him the apple. He takes it and runs.  1004,WAYNE,"Pretty generous, for a thief. Selina recognizes the voice. Turns to find Wayne - strong, but weathered. Beard, work clothes.  "1005,SELINA,You came back. I thought they'd killed you.  1006,WAYNE,Not yet.  1007,SELINA,If you're expecting an apology -  1008,WAYNE,It wouldn't suit you. I need your help.  1009,SELINA,And why would I help you?   Wayne pulls a USB drive out of his pocket.  1010,WAYNE,For this. The 'Clean Slate'.  1011,SELINA,You're gonna trust me with that? After what I did to you?  1012,WAYNE,"I admit I felt a little let down. But I still think there's more to you. In fact, I think for you - "1013,SELINA,Start fresh? I can't even get off this island.  1014,WAYNE,I can give you a way off. Once you've gotten me to Lucius Fox. I need you to find out where they're holding him. Then take me in.    1015,SELINA,Why do you need Fox?  1016,WAYNE,To save this city.  1017,SELINA,Who says it needs saving? Maybe I like it this way.  1018,WAYNE,Maybe you do. But tomorrow that bomb's going off.  1019,SELINA,Get your powerful friend on the case.    1020,WAYNE,I'm trying. But I need Fox.  Gordon and his Men are in two-man teams. Gordon is walking down the street with Miranda. He hands her a Geiger counter.  1021,GORDON,1022,BLAKE, 1023,GORDON,"Got it.   They keep moving, turning down the next street...into an ambush. Dozens of Mercenaries, weapons trained.  "1024,MERCENARY,"Commissioner Gordon, you're under arrest.  "1025,GORDON,On whose authority?  1026,MERCERNARY,"The people of Gotham.   Blake, from his vantage point, watches Gordon, Miranda and the other Cops being rounded up and led away...    "1027,MIRANDA,Bruce?    1028,FOX,"You picked a hell of a time to go on vacation, Mr. Wayne.  "1029,WAYNE,How long until the core ignites?    1030,FOX,That bomb goes off in twelve hours.  1031,WAYNE,Unless we can connect it to the reactor.  1032,FOX,If you can get it there. I'll find a way to plug it back in. 1033,WAYNE,Not tonight. I'm sorry.  1034,MIRANDA,Do what's necessary.    1035,WAYNE, 1036,FOX,What for?  1037,WAYNE,To get me back in the game. Catwoman comes down the stairs with the Thugs.    1038,CATWOMAN,"Sorry to spoil things, boys, but Bane wants these guys himself... The thugs pull Wayne and Fox to their feet - Miranda looks up.  "1039,WAYNE,I won't forget about you.  1040,MIRANDA,I know.    1041,FOX,"I like your girlfriend, Mr. Wayne.    "1042,CATWOMAN,He should be so lucky. And she's gone. Fox turns to Wayne. Who shrugs.      1043,WAYNE,Any move I make against Bane or the bomb - the triggerman sets it off.  1044,FOX,"They can't be using radio or cell - too much interference. Infrared doesn't have the range. It could only be micro-burst long wave... Wayne opens a panel in the wall, takes out equipment: mini-mines, Batarangs, utility belt...  "1045,WAYNE,Could you block it?  1046,FOX,Yes. I need the EMP cannon-guidance mount from the Bat. You remember where you parked? Wayne nods. Smiles. The Batsuit rises from the floor...  1047,CRANE,The charges are espionage and attempted sabotage... Do you have anything to say in your defense?  1048,GORDON,"No lawyer, no witnesses. What sort of due process is this?  "1049,CRANE,"More than you give Harvey's prisoners, Commissioner. Your guilt is determined, this is merely a sentencing hearing. What's it to be, death or exile?  "1050,GORDON,"Crane, if you think we are going willingly out onto that ice, you've got another think coming.  "1051,CRANE,"Death, then?  "1052,GORDON,Looks that way.  1053,CRANE,1054,BANE,Bring her to me.    1055,LUCIUS,I think it's time to talk about my year-end bonus...      1056,FOX,She fly pretty well?  1057,WAYNE,Even without the autopilot...  1058,FOX,Autopilot? That's what you're there for.    1059,BATMAN,"Light it up.  Gordon, energized by the familiar voice, lights the flare - jams it into the liquid, sending a trail of FIRE across the ice - up into a building where it forms the shape of a  BAT...      "1060,FOLEY'S KIDS,Dad! Check it out!    1061,FOLEY'S WIFE,"Honey, take a look! Foley moves to a back window. Sees the flaming sign.      "1062,MERCENARY,Sir?   Bane turns. The Mercenary points at the sign.  1063,MERCENARY,You think it's really him?    1064,BANE,Impossible...    1065,BATMAN,This blocks the remote detonator signal to the bomb. Get it onto the truck by sunrise. They might hit the button when it starts.    1066,GORDON,When what starts?  1067,BATMAN,War.      1068,BLAKE,You missed a spot. Batman boots him in the head as he moves towards Blake.    1069,BATMAN,"If you're working alone, wear a mask.  "1070,BLAKE,No one cares who I am.  1071,BATMAN,The mask is not for you. It's to protect the people you care about.    1072,BLAKE,Huh. And you always seem to know where those people are. How is that?  1073,BATMAN,I lost someone once. Since then I break into their homes when they're sleeping and implant a tracking device on the back of their neck.   Blake laughs. Then feels the back of his neck. Batman tosses Blake a mini-mine.  1074,BATMAN,"On three - one, two, three - They throw the mini-mines at the rubble of the entrance - the blasts barely move any rubble.    "1075,BLAKE,"No offense, but you got anything bigger in that belt?  "1076,BATMAN,That's to warn the men on the other side. Batman disappears into the shadows.  1077,BLAKE,But how do we -? KAABOOOM! The Bat's cannons light up the night.  1078,BLAKE,"Okay.   Cops climb out into the cold night - skinny, ragged, but glad to be alive and carrying guns...  "1079,BLAKE,What now?    1080,BATMAN,All-out assault on Bane...but you need to get the people you care about across the bridge.    1081,BLAKE,Why?  1082,BATMAN,In case we fail. Lead an exodus across the bridge. Save as many lives as you can.  1083,BLAKE,Don't you need me here?    1084,BATMAN,You've given me an army. Now go. Blake nods. Turns to leave. Stops.  1085,BLAKE,Thank you.    1086,BATMAN,Don't thank me yet.  1087,BLAKE,I might not get a chance later.   Batman nods. Blake disappears into the night.    1088,CATWOMAN,"Oh, you shouldn't have... She hops on, feeling the controls.    "1089,BATMAN,"The mid-town tunnel's blocked by debris, but the cannons give you enough firepower to make a path for people.   Catwoman marvels at the controls...  "1090,BATMAN,"To start it, you -    VARROOOM!  "1091,CATWOMAN,I got it.    1092,BATMAN,We've got forty-five minutes to save this city -  1093,CATWOMAN,"No, I've got forty-five minutes to get clear of the blast radius, because you don't stand a chance against these guys.  "1094,BATMAN,With your help I might.   She shakes her head.  1095,CATWOMAN,"I'll open that tunnel, then I'm gone.   He looks at her.  "1096,BATMAN,There's more to you than that. She stares back at him. Facade slipping a touch.    1097,CATWOMAN,"Sorry to keep letting you down. He says nothing. She looks at him, imploring. Come with me. Save yourself. You don't owe these people anymore - you've given them everything...  "1098,BATMAN,Not everything. Not yet.   Batman turns. Catwoman watches him go. Then fires up the bike and takes off.    1099,FOLEY,There's only one police in this city. He steps forward. The line follows.      1100,BANE,Open fire.    1101,GORDON,"Come on, come on...    "1102,BANE,You came back. To die with your city.  1103,BATMAN,"No. I came back to stop you.  145.     Bane leaps at Batman, smashing powerful blows into his head. Batman ducks, weaves and smashes his fists into Bane's side. Someone is watching from the window of City Hall - Miranda.      "1104,GORDON,That's impossible... Come on! Cut over to Fifth!   They sprint for the next parallel avenue...    1105,BLAKE,"Knock on doors, spread the word - the bomb's going to blow! Get out by the South Street tunnel, or over the bridge! Do two blocks, then get back to the bus! The boys race down the street. Father Reilly climbs into the bus.      "1106,BANE,"Stay back. He is mine - Bane SMASHES Batman's head - moves in for the kill, but Batman SMASHES Bane to the ground, RIPS sideways across the tubes of Bane's mask with the blades of his forearm. Bane bellows, thrashing in AGONY. Batman holds him down with a hand on his throat - searches him with his free hand.  "1107,BATMAN,Give me the trigger! You'd never give it to an ordinary citizen - Bane's thrashing calms as he stares at Batman through pain-soaked eyes...gasping through his broken mask for relief.    1108,BANE,I broke you. How have you come back?  1109,BATMAN,"You thought you were the only one who could learn the strength to escape? Bane looks at Batman, curiosity behind his pain.    "1110,BANE,I never escaped - R¯'s al Gh¯l  1111,A U,rescued me. That is why I must fulfill his plan. That is why I must avenge his murder.    1112,BATMAN, 1113,A U, CLIMB -  1114,A,Gh¯l...  1115,U,"Batman flinches, frozen as Miranda leans into his ear...   "1116,MIRANDA,"I am. Miranda has a knife through Batman's suit, into his ribs... And though I am not 'ordinary', I am a citizen...   She pulls out the trigger...    "1117,MIRANDA/TALIA,My mother named me Talia before she was killed. The way I would've been killed if not for my protector...Bane.   1118,BANE,Goodbye. Then is overrun.  1119,TALIA,I climbed out of the pit... 1120,A U,"stop. R¯'s al Gh¯l has found Bane, bandaged.  "1121,A U,   1122,TALIA,The League took us in. Trained us...      1123,TALIA,But my father could not accept Bane. R¯'s al Gh¯l watches Bane training. Turns away.  1124,A U,     1125,TALIA,"He saw only a monster who could never be tamed. Whose very existence was a reminder of the hell he'd left his wife to die in. He excommunicated Bane from the League of Shadows. His only crime was that he loved me. I could not truly forgive my father... Talia looks at Batman, cold. Until you murdered him.    "1126,BATMAN,He was trying to kill millions of innocent people -  