Response,Speaker,What is said547,WAYNE,Someone else will work out what Dr. Pavel did. Someone else will figure out how to turn this power source into a nuclear weapon. I need you to take control of Wayne Enterprises and this reactor.  548,MIRANDA,And to do what with it?    549,WAYNE,Nothing. Until we can find a way to guarantee its safety.  72.    550,MIRANDA,And if we can't?    551,WAYNE,Decommission it. Flood it.  552,MIRANDA,Destroy the world's best chance for a sustainable future?    553,WAYNE,If the world's not ready. Yes.  554,MIRANDA,"Bruce, if you want to save the world you have to start trusting it.  "555,WAYNE,I'm trusting you.    556,MIRANDA,Doesn't count. You have no choice.  557,WAYNE,"I could've flooded this chamber any time in the last three years. I'm choosing to trust you, Miranda, and that's not the easiest thing for me. Please. His eyes are genuine. Pleading. Miranda nods.    "558,FOX,We have a board meeting to get to.    559,DAGGETT,"I'd like to point out that we have a non-board member here. Highly irregular, even if it is his family name above the door... All eyes go to Wayne. An older member of the board pipes up.    "560,FREDERICKS,Bruce Wayne's family built this  COMPANY -  73.      BOARD MEMBER 2 And he himself has run it -  561,DAGGETT,"Into the ground, sir. Anybody disagree? Check the value of your shares this morning. Gambling on crazy futures didn't just lose Mr. Wayne his seat, it's lost us all a lot of money. He needs to leave.    "562,FOX,"I'm afraid he has a point, Mr. Wayne.  "563,WAYNE,I understand. Ladies and gentlemen.   Wayne glances at Miranda who nods at him. Wayne leaves.  564,DAGGETT,Let's get down to business.    565,FOX,Right away.    566,REPORTER,"Wayne, how's it feel to be one of the people?!    "567,COMPANY VALET,"I'm sorry, sir, they had paperwork  -   Wayne looks over to see his Lamborghini being towed.  "568,BLAKE,Looks like you need a lift. Wayne turns to see Blake standing by his patrol car. Nods.  74.      569,DAGGETT,How the hell did Miranda Tate get the inside track on the Wayne board?! Was she meeting with Wayne? Was she sleeping with Wayne?  570,STRYVER,Not that we know of -  571,DAGGETT,"Clearly you don't 'know of' anything, do you?! Where's Bane?!    "572,STRYVER,We told him it was urgent -  573,DAGGETT,Then where is the masked -    574,BANE,Speak of the devil... Daggett turns. Bane is already there.  575,BANE,...and he shall appear.  576,DAGGETT,What the hell's going on?  577,BANE,The plan is proceeding as expected.  578,DAGGETT,You see me running Wayne 579,BANE, 580,DAGGETT,You stay right there! I'm in charge! Bane places a gentle hand on Daggett's shoulder.    581,BANE,Do you feel in charge? Daggett is taken aback. Stryver leaves.    582,DAGGETT,I've paid you a small fortune -  583,BANE,And that gives you power over me?   Daggett considers the heavy hand on his shoulder. Nervous.  584,DAGGETT,What is this?  585,BANE,Your money and infrastructure have been important. Till now.  586,DAGGETT,What are you?    587,BANE,Gotham's reckoning. Come to end the borrowed time you've all been living on...   Bane gently takes the terrified Daggett's head in his hands...  588,DAGGETT,You are true evil...    589,BANE,"I am necessary evil. Stryver, on the steps outside the living room, flinches.      "590,BLAKE,When you began...why the mask?    591,WAYNE,To protect the people closest to me.    592,BLAKE,You're a loner with no family.  593,WAYNE,There are always people you care about. You just don't realize how 594,BLAKE,It was damn good to see him back.  595,WAYNE,Not everybody agrees.  596,BLAKE,They'll figure it out in the end.  597,WAYNE,Got anything on Bane's whereabouts?  598,BLAKE,"Yeah, I've got five hundred pages of tunnel records and a flashlight. I could use some help.  "599,WAYNE,You know what? Drop me in Old Town...  600,WAYNE,Don't wait. I'll get a cab.  601,BLAKE,You got money?  602,WAYNE,"Actually, no. Blake hands him some bills, watches him cross the street. The radio squawks. Blake reacts - drives off.  "603,JEN,"I told you, money first.  "604,WAYNE,I don't think so.  605,SELINA,He's not a mark. Jen looks at Selina. At Wayne.  606,SELINA,"And he doesn't have a cent to his name, anyway.  "607,SELINA,608,WAYNE,"Actually, they're letting me keep the house.  "609,SELINA," The rich don't even go broke same as the rest of us, huh?  "610,WAYNE,611,SELINA,Let's just say that I've incurred the wrath of some people less susceptible to my charms than you.  612,WAYNE,My powerful friend hopes to change your mind about leaving.  613,SELINA,And how would he do that?  614,WAYNE,By giving you what you want.  615,SELINA,It doesn't exist.  616,WAYNE,He says it does. He wants to meet. Tonight.  617,SELINA,Why?    618,WAYNE,He needs to find Bane. He thinks you'd know how.  619,SELINA,"Tell him I'll think about it. Wayne nods, starts to leave.  "620,SELINA,Mr. Wayne? I'm sorry they took all your money.  621,WAYNE,"No, you're not.      "622,FOLEY,"Can we help you, officer?  "623,BLAKE,John Daggett's body was found in a dumpster an hour ago. I thought you might like to know.    624,GORDON,Why?  625,BLAKE,Because Daggett's name is all over the permits I pulled to map the tunnels under Gotham. Blake hands Gordon a stack of files. Foley glares at Blake.    626,BLAKE,"MTA maintenance, sewer construction...  "627,GORDON, 628,FOLEY, 629,GORDON,"Get more men, work a grid. I want him found.  "630,FOLEY,"Yeah, yeah - the masked man. We're on it.   Gordon eyes the files hungrily - glances up at Blake.  "631,GORDON,This is good work. Lose the uniform - you're working for me now. We could use some hotter heads around here.  80.      632,BLAKE,This could just be a coincidence.  633,GORDON,"You're a detective now, son, you're not allowed to believe in coincidence anymore. Blake tries to conceal his excitement from Foley.      "634,WAYNE,No. I'm on my own now.    635,MIRANDA,Do you have keys? Wayne looks a little helpless all of a sudden.    636,WAYNE,Never needed them... She takes his hand.  637,MIRANDA,Let's find a window.    638,MIRANDA,"Fox worked the board like you've never seen - I'm in, Daggett's out and he's not happy. Wayne sets down the newspaper:  "639,FROM BILLIONAIRE TO BUM, 81.      640,WAYNE,Hope you don't like me for your money. Miranda kicks off her shoes. Glances at the paper.    641,MIRANDA,Suffering builds character. Then at a photo of Wayne's parents.    642,MIRANDA,"I'll take care of your parents' legacy, Bruce. Miranda picks up a photo of Rachel.    "643,MIRANDA,Who's this? Wayne looks at her. Can't find words...  644,MIRANDA,Where's Alfred?  645,WAYNE,He left. Taking everything. Miranda puts the photo down. Kisses him. Passionately. Then again. He kisses back. Suddenly the lights go out.  646,MIRANDA,What's that?    647,WAYNE, 648,WAYNE,You're pretty good at that.    649,MIRANDA,"When I was a child we had almost nothing. But on the nights we had a fire, we felt very rich indeed. She returns to him, pulling a blanket around both of them.  82.    "650,WAYNE,I assumed your family was wealthy.  651,MIRANDA,Not always. Not when I was young.   He traces a scar on her shoulder.  652,MIRANDA,An old mistake.    653,WAYNE,"I've made a few myself. She turns to him, tracing the scars across his chest.  "654,MIRANDA,655,WAYNE,"Someday perhaps. Not tonight. She pulls him close. He kisses her. They fold into each other, the warm heart at the center of a vast, cold room.      "656,CATWOMAN,Don't be shy.   ...Batman is there.  83.      657,CATWOMAN,Wayne says you can get me the 'Clean Slate'.  658,BATMAN,That depends.  659,CATWOMAN,On what?  660,BATMAN,On what you want it for. I acquired it to keep it out of the wrong hands.  661,CATWOMAN,"Still don't trust me, huh? How can we change that?  "662,BATMAN,Start by taking me to Bane.  663,CATWOMAN, 664,CATWOMAN,"From here, Bane's men patrol the tunnels...and they are not your average brawlers.  "665,BATMAN,Neither am I. Catwoman swings into a -    666,CATWOMAN,He's behind you.  84.      667,MERCENARY, 668,BATMAN,"Me. Darkness smashes onto the Mercenary. Gunfire in the tunnel. Catwoman races along, pursued by a Mercenary. He is yanked off his feet by darkness - he screams... Batman picks off more and more Mercenaries. Screams echo... Batman follows Catwoman through the dark tunnel.  "669,CATWOMAN,"Just a little further. A grate slams down, separating them - the lights come on. He is deep inside.      "670,CATWOMAN,I had to find a way to stop them trying to kill me.  671,BATMAN,You've made a serious mistake.  672,BANE,"Not as serious as yours, I fear. Batman turns. Bane emerges from behind the waterfalls.  "673,BATMAN,Bane.  674,BANE,"Let's not stand on ceremony here, Mr. Wayne.   Catwoman hears the name. Less sure of what she's done. Batman moves at Bane - strikes powerful blows - Bane catches his fist.  "675,BANE,"Peace has cost you strength. Victory has defeated you.  85.     Bane SMASHES Batman back - kicks him off the catwalk - Batman drops, uses his cape to land. Bane climbs down on a chain - his men watch in disciplined silence - Batman hurls flashbangs at Bane, who doesn't flinch.    "676,BANE,Theatricality and deception are powerful agents...to the uninitiated. Batman lashes out at Bane - Bane counters - they separate.    677,BANE,"But we are initiated, aren't we, Bruce? The League of Shadows. And you betrayed us...    "678,BATMAN,Us? You were excommunicated. From a gang of psychopaths.  679,BANE,"Now I am the League of Shadows, here to fulfill R¯'s al Gh¯l's  "680,A U,"destiny... Batman hurls himself at Bane, throwing him into the waterfall, where he smashes his fists and gauntlets into Bane's mask again and again, water cascading over them.   Bane is not moving. Just taking the blows. Batman pauses. Bane's arms SHOOT OUT, SMASHING Batman aside - Bane RISES...  "681,BANE,You fight like a younger man. Nothing held back. No reserves. Admirable. But mistaken. Batman hits a switch on his belt - the lights go out - Bane turns slowly addressing all the shadows at once.    682,BANE,"You think darkness is your ally. But you merely adopted the dark. I was born in it. Formed by it...   In the shadows, Batman circles, looking to strike...  "683,BANE,I didn't see the light until I was already a man. And by then it was nothing to me but blinding...  86.     Bane lunges backwards into the darkness - Batman's throat in his grasp.  684,BANE,"The shadows betray you, because they belong to me...   Bane SMASHES him into the ground, POUNDING, pounding, pounding the hard cowl with his bare fists until it CRACKS. Bane RISES from Batman, gestures to the ceiling of the chamber - explosive charges have been drilled into holes...  "685,BANE,I will show you where I've made my home while preparing to bring justice. Then...I will break you.   A Mercenary tosses Bane a detonator - Batman watches through cracked cowl - Bane hits the detonator - explosions BURST over his head as the ceiling CRUMBLES revealing: Applied Sciences - Bane has dropped the bottom out of Fox's weapons store...a camouflage Tumbler rests in the rubble.  686,BATMAN,No...  687,BANE,Your precious armory. Gratefully accepted. We will need it.    688,BANE,"I wondered which would break first - your spirit...   Batman SWINGS at him - misses - Bane GRABS him, lifts him  HIGH. ...or your body. Bane brings Batman down onto his knee, BREAKING his back with a horrific CRACK.  87.     In the shadows, Catwoman looks on. Shocked. Bane crouches to pull the broken cowl off the broken Wayne. Mercenaries lift Wayne's body and carry him off... Bane stares into the hollow eyes of his trophy...   Catwoman slinks back into the shadows, and we -  FADE TO BLACK.  FADE IN:      "689,BLAKE, 690,UNIFORM,"Excuse me, Miss. I need to see your ticket and identification, please.   Selina, surprised, fumbles with her purse.  "691,SELINA,"Would you mind?  88.     She hands the Uniform her hat - punches him through the brim, stuffs him in a closet - plants her mangled hat on his head.      "692,BLAKE,I showed your picture to the Congressman and guess what?  693,SELINA,"Don't tell me, still in love?  "694,BLAKE,"Head over heels. Pressing charges, though. Blake lays a police file down with a thump. You've made some mistakes, Ms. Kyle.    "695,SELINA,Girl's gonna eat.  696,BLAKE,You have an appetite. Why run? You can't hide from us with this record.  697,SELINA,Maybe it's not you I'm running from.  698,BLAKE,Who then? Bane? What do you know about him?    699,SELINA, 700,BLAKE,"We can offer you protection... Selina looks at him with contempt. Blake shrugs, switches off the tape, moves to the door.    "701,BLAKE,"When I spotted you, I was looking for a friend...Bruce Wayne. Selina turns to look at Blake. His eyes plead with her.    "702,BLAKE,Did they kill him?  703,SELINA,"I'm not sure.   And we -  CUT TO: BLACK SCREEN. Sounds: screaming, laughing, CRYING. Sights: LIGHT, bodies FALLING, a DARK SKULL... And we are -    "704,WAYNE,Why didn't you just kill me?    705,BANE,You don't fear death. You welcome it. Your punishment is to be more severe.    706,WAYNE, 707,BANE,Yes. But not of your body. Of your soul. Wayne exhales. Eyes losing focus from sheer pain.  90.      708,WAYNE,Where am I?  709,BANE,"Home.   Wayne's eyes dart about: filthy stone walls, distant sunlight from above, iron bars: an underground prison. Where I learned the truth about "710,A,Gh¯l's destiny. We will destroy  711,U,Gotham. And when it is done...when Gotham is ashes...then you have my permission to die. Bane rises. Leaves. Wayne drifts back to unconsciousness.      712,GUARD,We're locking her up in here?  713,WARDEN,The Dent Act allows non-segregation based on extraordinary need. First time she broke out of women's correctional she was sixteen. Selina passes a Huge Inmate who strains through the bars...    714,HUGE INMATE,"Little closer, baby...  "715,SELINA,"Why, honey, you wanna hold my hand?   Without breaking step, she slips his outstretched hands between her handcuffed ones and cartwheels, snapping his arms - he screams in agony - she keeps walking...  "716,WARDEN,She'll be just fine.      717,FOX,I don't see the need for a board meeting on the energy project -  718,MIRANDA,Bruce got a lot of things right. Keeping the board in the dark wasn't one of them... Fox swings the doors to the boardroom open...      719,BANE,This meeting is called to order. Fox and Miranda freeze. Staring at the mask.  92.      720,BANE,"Chair and President. I also need one ordinary member - Mr. Fox, would you care to nominate?    "721,FREDERICKS,No. I volunteer. The dignified older board member gets to his feet. Mercernaries round the three up.    722,FOX,Where are you taking us?  723,BANE,Where you buried your resources. The bowels of Gotham.      724,GORDON,So you think our friend is gone again?  725,BLAKE, 726,FOLEY,"Okay, Commissioner, you were right.  "727,GORDON,What's happened?    728,FOLEY,"Your masked man kidnapped the Wayne Enterprises board. He let most of them go, but took three down into the sewers.    "729,GORDON,"No more patrols, no more hide and seek. Send every available cop down there to smoke him out.  93.      "730,FOLEY,The Mayor won't want panic -  731,BLAKE,So it's a training exercise.   Foley looks at Gordon.  732,FOLEY,I'm sorry for not taking you  SERIOUSLY -    733,GORDON,Don't apologize for believing the world's in better shape then it is...just fight to make it true.   Foley nods. Leaves. Blake gets up.  734,GORDON,"Not you. You're telling me the Batman's gone. So you chase up the Daggett leads, any way you can.   Blake nods.    "735,PRISONER,He asks if you would pay us to let you die. I told him you have nothing.  736,WAYNE,Do it for the pleasure.   The Prisoner puts bread to Wayne's lips.  737,PRISONER,"They pay me more than that to keep you alive.   A chant gets Wayne's attention. He rolls his head painfully to watch a Tattooed Prisoner hand a thick rope to a Strong Man, who ties it around his chest, watched by other Prisoners.  94.      "738,PRISONER,"He will try the climb. Strong Man starts scaling the wall. The Prisoners' chant grows stronger as he climbs towards the light.   Above: Strong Man stops, perched on a ledge, a twelve-foot leap from the rest of the climb... The chanting peaks as Strong Man leaps...misses...falls. The rope catches - he swings into the rock face. Prisoners fall silent as Strong Man is lowered, broken, bloody, to the prison floor.    "739,WAYNE,Has anyone made it?  740,PRISONER,Of course not.   The Blind Prisoner barks at him.  741,WAYNE,What does he say?    742,PRISONER,He says there is one who did. A child... 743,PRISONER,A child who had been born in this hell...  744,WAYNE,Bane.    745,PRISONER,An old legend. Nothing more. The Prisoner leaves Wayne's cell - switches on the TV.    746,WAYNE,Don't.  747,PRISONER,Whatever they want you to see...it's happening soon.  95.      748,BANE,Turn it on.   Fox shakes his head. Bane holds his gun to Fredericks' head.  749,BANE,I only need one other board member. There are eight more waiting upstairs.    750,FOX,I won't do it. Fredericks trembles. Bane cocks the weapon.    751,MIRANDA,"Alright, stop. She walks up to the scanner. Places her hand on it. It beeps. She turns to Fox. Quietly pleading.  96.    "752,MIRANDA,"Lucius, you'll kill this man and yourself, and barely slow them down. Fox reluctantly puts his hand on the scanner. Then Fredericks. The core glows brighter and brighter. Dr. Pavel is transfixed.    "753,BANE,"Do your work. Bane turns to his men. Gestures at the hostages. Take them to the surface. People of their status deserve to see the next era of western civilization. Fox, Miranda and Fredericks are led back into the rubble.    "754,REPORTER,We're seeing literally thousands of police heading into the sewers -  755,MAYOR,"A training exercise, that's all. If you'll excuse me, I've got tickets to watch our boys thrash Rapid City. The Mayor heads into the stadium with the crowds...      "756,BLAKE,"I've been to half Daggett's cement plants, logged locations they've poured for underground construction...  97.      "757,GORDON,Anything strange about the pourings? Blake glances at a large map - dots mark pouring locations.    758,BLAKE,"Honestly, Commissioner, I don't know anything about civil engineering.    "759,GORDON,But you know about patterns. Keep looking. Blake pulls up in front of a cement plant.      760,BANE,761,BANE,"Five, by my calculations.    DR. PAVEL And then it will go off.  "762,BANE,"For the sake of your family, Dr. Pavel, I hope so.   Dr. Pavel stares as Mercenaries start to disconnect the core...  98.    "763,WORKER,Boss is about to leave. Blake walks past cement mixers. Spots someone. A Driver.    764,BLAKE,Hey. The Driver turns.  765,BLAKE,"That was you outside the stock exchange, right?  "766,DRIVER,When?    767,BLAKE,When? When half the city's cops were trying to pull onto Castle Street and your truck shut them out.    768,DRIVER,Oh yeah. You're that cop -  769,BLAKE,"Detective, now.   Behind Blake the Worker puts his hand is his pocket...  "770,BLAKE,"And as a detective...I'm not allowed to believe in coincidences  ANYMORE - Blake spins, drawing his weapon. The Worker lunges with a knife, Blake smashes his hand to one side and shoots him. The Driver grabs him from behind. Blake wrestles, but the Driver is strong, trained. Blake can't aim his gun, he fires behind, into a steel mixer - the bullets ricochet, one catches the Driver in the back and he goes down... Blake, gasping, kneels beside the Driver.  "771,BLAKE,What were you doing?! What?!   The man dies. Blake looks down at his gun. Disgusted. Tosses is down. Pulls out his phone. Dials.  99.      772,BLAKE,"Commissioner, I'm at the Fourteenth Street plant with two dead witnesses and a lot of questions. Call me -   Blake freezes, stooped to pick up his gun. Looking at some empty barrels... Commissioner, they've got "773,BLAKE,"Oh, God.   Blake fires up the cruiser and pulls out, hard.    "774,BLAKE,Patch me into Foley!  775,DISPATCH, 776,BLAKE,They're heading into a trap!      777,FOLEY,Foley.  778,BLAKE,It's a trap! Pull everyone out! Bane's been pouring concrete laced with explosives -  100.      779,FOLEY,Where?  780,BLAKE,There's a ring around the tunnels - they're gonna blow it and trap the cops underground! Foley looks up with dread at the mouth of the tunnel.  781,FOLEY,Pull out! Pull 'em out!    782,BANE,Let the games begin. The Mercenaries hit the detonators.      783,BANE,"Gotham, take control of your city...      "784,BLAKE,Foley?  785,FOLEY, 786,BLAKE, 787,GORDON,"Clear the corners, rookie. Blake turns. Gordon holds his service weapon. The Mercenaries are on the ground, dead.  "788,GORDON,"Get my coat, son.  103.      "789,BANE,This is the instrument of your liberation...    790,ANALYST,Satellite shows a radiation spike...    ANALYST 2 Whatever it is...it's nuclear.    791,BANE,"Identify yourself to the world.  DR. PAVEL Dr. Leonid Pavel, nuclear physicist. Bane turns Dr. Pavel's head for the cameras.      "792,CIA ANALYST,"Pavel was confirmed dead - plane crash on an Agency pull-out of Uzbekistan... But it certainly looks like him - He points to a monitor with a photo of Dr. Pavel. An Air Force General rubs his chin, thinking, nervous.  104.      "793,BANE,Tell the world what this is.    DR. PAVEL A fully primed neutron bomb. With a blast radius of six miles.  794,BANE,And who can disarm this device?  DR. PAVEL Only me.  795,BANE,"Thank you, Doctor. Bane snaps Dr. Pavel's neck in front of the world.  "796,BANE,"The bomb is armed, the bomb is mobile, the identity of the triggerman is a mystery. One of you holds the detonator - we come not as conquerors, but as liberators to return control of this city to the people. At the first sign of interference from the outside world or of people attempting to flee, this anonymous Gothamite, this unsung hero, will trigger the bomb. For now, martial law is in effect. Return to your homes, hold your families close, and wait. Tomorrow you claim what is rightfully yours. Bane turns, leaves the field, followed by his men.      "797,GENERAL,"Pull back the fighters, start high-level reconnaissance flights. And get the President on the line.      "798,LEAD MERCENARY,"Tanks and planes cannot stop us detonating our device. Send an emissary to discuss terms of access for supplies and communication.   A Captain steps forward, walks to the apex of the bridge.  "799,CAPTAIN,"How many of you are there, son? "800,LEAD MERCENARY,We don't. But you do.    801,CAPTAIN,Why in the hell would we help you keep your hostages?  802,LEAD MERCENARY,If people start crossing this bridge Gotham gets blown to hell. The Captain considers this. Troubled.      803,PRESIDENT, 804,PRESIDENT, 805,PRESIDENT, 806,BLAKE,What does that mean?  807,GORDON,It means we're on our own. I have to get in front of a camera -  808,BLAKE,"Sir, they'll kill you the second you show your face -    "809,GORDON,The Mayor's dead. I'm the symbol of law and order. Bane says he's giving Gotham back to the people - they need to know that I could lead.  810,BLAKE,Bane's not gonna let that happen -    811,GORDON,Then he'll show his true colors.  812,BLAKE,And you'll be dead.   Gordon says nothing.  107.      813,BANE,Behind you stands a symbol of oppression. Blackgate Prison...    814,BANE,Where a thousand men have languished for years. Under the Dent Act. Under the name of this  MAN -    815,BANE,"Harvey Dent. Held up to you, and over you, as a shining example of justice and good...      "816,BLAKE,"We're gonna keep moving you, till we can get you in front of a camera  -      "817,BANE,But they supplied you a false idol. A straw man. To placate. To stop you tearing down this corrupt city...      818,BANE,...and rebuilding it the way it should have been rebuilt generations ago...      819,BANE,"Let me tell you the truth about Harvey Dent. In the words of Gotham's Police Commissioner, James Gordon...    "820,BANE,"'The truth about Harvey Dent is simple in only one regard - it has been hidden for too long. After his devastating injuries, Harvey's mind has recovered no better than his mutilated face. He was a broken, dangerous man, not the crusader for justice that I, James Gordon, have portrayed him to be for the last eight years. Harvey's rage was indiscriminate. Psychopathic. He held my family at gunpoint, then fell to his death in the struggle over my son's life. The Batman did not murder Harvey Dent - he saved  "821,BANE,'I praised the madman who tried to murder my own child.'      822,BANE,"'The things we did in Harvey's name brought desperately needed security to our streets... But I can no longer live with my lie. It is time to trust the people of Gotham with the truth, and it is time for me to resign.'   Bane folds the papers. Looks out to the stunned crowd. Do you accept this man's resignation?   Individuals in the crows start shouting 'Yes!'    "823,BANE,Do you accept the resignation of all the liars?! All the corrupt?! More and more of the crowd is chanting 'Yes!'    824,BLAKE,"These men, locked up in Blackgate for eight years, denied parole under the Dent Act. Based on a lie.  "825,GORDON,"A lie to keep a city from burning to the ground. Gotham needed a hero, someone to believe in -  "826,BLAKE,Not as much as it does now. But you betrayed everything you stood for.    827,GORDON,