Response,Speaker,What is said264,FOX,"Well, then I have just the thing for an eccentric billionaire who doesn't like to walk... Fox opens a door - we glimpse a sleek vehicle. Wayne's eyes light up.  "265,WAYNE,Now you're just showing off.  266,FOX,Defense Department project for tight-geometry urban pacification. Rotors configured for maneuvering between buildings without recirculation.  267,WAYNE,What's it called?  268,FOX,"It has a long and uninteresting Wayne Enterprises designation. So I took to calling it the Bat. And yes, Mr. Wayne, it does come in black. Wayne touches its sleek side. Marveling.  "269,FOX,Works great except for the autopilot.  270,WAYNE,What's wrong with that?  271,FOX,Software-based instability. Take a better mind than mine to fix it.  272,WAYNE,Better mind?  273,FOX,"I was trying to be modest. A less busy mind. Yours, perhaps. Wayne looks wistfully at the machine. Turns away.  "274,WAYNE,"I told you. I retired, Lucius.  "275,DOCTOR,I've seen worse cartilage in knees   276,WAYNE,That's good -  277,DOCTOR,"No, that's because there is no cartilage in your knee. And not much of any use in your elbows and shoulders. Between that and the scar tissue on your kidneys, residual concussive damage to your brain tissue and general scarred-over quality of your body...  I cannot recommend that you go heli-skiing. About the only part of your body that looks healthy is your liver, so if you're bored I recommend you take up drinking, Mr. Wayne.  "278,GORDON,We were in this together. Then you were gone...  279,WAYNE,The Batman wasn't needed anymore. We won.  280,GORDON,Built on a lie. Our lie. Now there's evil rising from where we tried to bury it. Nobody will listen... The Batman has to come back.  281,WAYNE,What if he doesn't exist anymore?  282,GORDON,He must. He must.  283,JEN,I told you - money first -  284,YUPPIE,"Goddammit, you took my wallet!    "285,SELINA,Get out.    286,YUPPIE,She took my wallet! Selina twists his arm behind him in a blinding move.  287,SELINA,"Now. She releases the Yuppie, who moves off down the stairs. Selina turns to Jen. Who is examining a wallet.  "288,SELINA,"I told you not to try it with the assholes, Jen.  "289,JEN,They're all assholes.   290,SELINA,"Okay, the assholes who hit.  "291,JEN,"I don't know what he's so upset about, he only had sixty bucks in here.  "292,SELINA,Probably the watch.    293,YOUNG WOMAN,Watch? Selina opens her hand and gives Jen the Yuppie's Rolex.      294,PAPARAZZI,"Another stiff too old to climb out of his sports car.  PAPARAZZI 2 No, that's Bruce Wayne! Hey, Wayne, where you been hiding? Lenses swing onto Wayne, who pushes a button on his key fob - a pulse. The cameras die. Wayne heads to the door.    "295,WAYNE,I'm not sure if my assistant put me on the guest list -  296,GREETER,"Right through here, Mr. Wayne...      "297,WAYNE,"Miss Tate, isn't it?  "298,MIRANDA,"Even before you became a recluse, you never came to these things...  "299,WAYNE,"True. Proceeds go to the big fat spread, not the cause. It's not about charity, it's about feeding the ego of whichever society hag laid it on.  "300,MIRANDA,"Actually, this is my party, Mr. Wayne.  "301,WAYNE,Oh.  302,MIRANDA,"And the proceeds will go where they should, because I paid for the big fat spread myself.  "303,WAYNE,That's very generous of you.  304,MIRANDA,You have to invest to restore balance to the world. Take our clean-energy project...    305,WAYNE,Sometimes the investment doesn't pay off. Sorry.    306,MIRANDA,"You have a practiced apathy, Mr. Wayne. But a man who doesn't care about the world doesn't spend half his fortune on a plan to save it... "307,MIRANDA,"Have a good evening, Mr. Wayne. Wayne watches Miranda glide away. Then turns to Selina.  "308,WAYNE,"Mind if I cut in? Rich Twit turns, annoyed - Wayne hands him his cane. Takes Selina by the waist. She glares at him.  "309,WAYNE,You don't seem very happy to see me.  310,SELINA,You were supposed to be a shut-in.    311,WAYNE,Felt like some fresh air.  312,SELINA,Why didn't you call the police?    313,WAYNE,I have a powerful friend who deals 314,SELINA,Yeah? Who are you pretending to be?  315,WAYNE,"Bruce Wayne, eccentric billionaire. Who's your date?  "316,SELINA,"His wife's in Ibiza. She left her diamonds behind, though. Worried they'd get stolen.    "317,WAYNE,It's pronounced 'Ibeetha'. You wouldn't want these folks realizing you're a crook not a social climber.    319,WAYNE,I doubt you care what anyone in this room thinks about you.  320,SELINA,"Don't condescend, Mr. Wayne. You don't know a thing about me.  "321,WAYNE,"Well, Selina Kyle, I know you came here from your walk-up in Old Town - modest place for a master jewel thief. Which means either you're saving for your retirement - or you're in deep with the wrong people.    "322,SELINA,You don't get to judge me because you were born in the master bedroom of Wayne Manor.  323,WAYNE,"Actually, I was born in the Regency Room.  "324,SELINA,I started off doing what I had to. Once you've done what you had to they'll never let you do what you want to.  325,WAYNE,Start fresh.    326,SELINA,There's no fresh start in today's world. Any twelve-year-old with a cell phone could find out what you did. Everything we do is collated and quantified. Everything sticks. We are the sum of our mistakes.      327,WAYNE,Or our achievements.  328,SELINA,The mistakes stick better. Trust me.    329,WAYNE,You think that justifies stealing?  330,SELINA,I take what I need to from those who have more than enough. I don't stand on the shoulders of people with less.  331,WAYNE,Robin Hood?  332,SELINA,I'd do more to help someone than most of the people in this room. Than you.    333,WAYNE,Maybe you're assuming too much.  334,SELINA,Or maybe you're being unrealistic about what's really in your pants other than your wallet.  335,WAYNE,Ouch.    336,SELINA,You think all this can last? Wayne glances around at the sumptuous party.    337,SELINA,"There's a storm coming, Mr. Wayne. You and your friends better batten down the hatches, because when it hits you're all gonna wonder how you ever thought you could live so large and leave so little to the rest of us.  "338,WAYNE,Sounds like you're looking forward to it.     339,SELINA,I'm adaptable.  340,WAYNE,"These pearls do look better on you then they did in my safe...   Wayne rolls her into his shoulder - reaches up to the back of her neck, unclasps the necklace. But I still can't let you keep them.   The pearls slide off her neck into his other hand. Selina looks at him. Angry. Then kisses him, hard, and disappears into the crowd. Wayne's cane reappears.  "341,RICH TWIT, 342,WAYNE,Not likely.      343,WAYNE,I must have lost my ticket -  344,VALET,"Your wife said you were taking a cab home, sir.    "345,WAYNE,My wife?    346,ALFRED,"Just you, sir?   Wayne gives him a withering glare.  "347,FOX,This is Fox.  348,WAYNE,Remember those 'unusual requests' I used to make?  349,FOX,"I knew it! Up front, Alfred listens. Concerned.  "350,ALFRED,"You've got the wrong leg, sir.  "351,WAYNE,You start with the good limb so it learns your optimum muscle patterns.  352,ALFRED,It is terribly painful?  353,WAYNE,"You're welcome to try it, Alfred.  "354,ALFRED,"Happy watching, thank you, sir. Wayne shouts as the brace clicks home. He gets to his feet.  "355,WAYNE,"Not bad - Wayne executes a perfect roundhouse, knocking out a brick. Not bad at all.   Alfred picks up the brick. Considers it. Uneasy. He follows Wayne across the bridge to the cube.  "356,ALFRED,"Master Wayne, if you're considering going back out there you need to hear some rumors surrounding Bane.  "357,WAYNE,I'm all ears.    358,ALFRED,"There is a prison. In a more ancient part of the world. A pit. Where men are thrown to suffer and die. But sometimes, a man rises from the darkness. Sometimes...the pit sends something back.  "359,WAYNE,Bane.  360,ALFRED,Born and raised in a hell on earth.  361,WAYNE,Born in a prison?  362,ALFRED,No one knows why. Or how he escaped. But they know who trained him one he did...R¯'s al Gh¯l. Your  363,A U,mentor.   Wayne takes this in. Shocked.  364,ALFRED,"He plucked Bane from a dark corner of the earth and trained him in the blackest disciplines of combat, deception and endurance. Just like you.  "365,WAYNE,Bane was a member of the League of Shadows.367,A,al Gh¯l is not to be trifled with.  369,WAYNE,I didn't realize I was known for trifling with criminals.  370,ALFRED,That was then. And you can strap up your leg and put the mask back on. But it won't make you what you were.  371,WAYNE,Which was?  372,ALFRED,Someone whose anger at death made him value all life. Even his own.  373,WAYNE,"If this man is all the things you say he is, then this city needs me. The Batsuit emerges from the cube.  "374,ALFRED,"Yes, this city needs Bruce Wayne. Your resources, your knowledge...not your body. Not your life. That time has passed.    "375,WAYNE,"I tried helping as Bruce Wayne, Alfred. And I failed.  "376,ALFRED,"You can fail as Bruce Wayne. As Batman, you can't afford to.  "377,WAYNE,That's what you're afraid of - that if I go back out there I'll fail.    378,ALFRED,No. I'm afraid that you want to. Wayne looks at Alfred. Then turns to examine the Batsuit.     380,BANE,Why else would you people be here? Bane grabs Trader 1 by the throat and drags him across the floor to an online automated trades terminal... He puts the man's thumb onto the print reader - the screen lights up.    381,BANE,"Enter your password. Or I send these men to your home.   Trader 1, terrified, types in his password. Outside, sirens. Shoeshine man pulls out a USB drive with an antenna - plugs it into the computer - figures race across the screen...    "382,BLAKE,"Move it, now! We've got a situation.  "383,CONSTRUCTION WORKER,Where can I move it?!    384,BLAKE,"That way! Blake points - but SWAT vehicles pile in, blocking.      "385,BLAKE,"Get in your vehicle and stay there! Foley and the SWAT Commander, Allen, approach the entrance. The Market Security Chief walks up, frantic.    "386,SECURITY CHIEF,You've gotta get in there!  387,FOLEY,This is a hostage situation -    388,SECURITY CHIEF,It's a robbery! They've got direct access to the online trading desk.  389,FOLEY,I'm not risking my men for your  MONEY -  390,SECURITY CHIEF,"It's not our money, it's everyone's!    "391,ALLEN,Really? Mine's in my mattress.  392,SECURITY CHIEF,"If you don't shut these guys down, the stuffing in that mattress might be worth a whole lot less, pal.  "393,FOLEY,Cut the fiber line - shut down the cell tower. That'll slow them down.      394,SHOESHINE MAN,They cut the fiber. Cell's working.  395,BANE,For now. How much longer does the program need?  396,SHOESHINE MAN,Eight minutes.    397,BANE,"Time to go mobile. Shoeshine Man picks up the laptop, slips it into his pack...      "398,ALLEN,"Get the barriers up - no more in and out on this street! Steel wedge-shaped barriers rise up at the mouth of the street. A Sniper watches the doors through a thermal scope. Six large heat signatures bloom, too big for people...    "399,SNIPER,"I've got something - The door explodes. SWATs duck, six sportbikes race out and leap the ramp-like barricades, sending SWATs scattering. Cops scramble to pull their vehicles out to give chase.    "400,ROOKIE COP,"Shoot the tires!   A Veteran Cop sights a shot, but the Traders are in the way.  "401,VETERAN COP,No shot!      402,FOLEY,"Back off, back off! They've got hostages!      "403,ROOKIE COP,"What's going on with the lights? The Veteran Cop looks back - streetlights and headlights are dying one after another. The darkness is chasing them - the darkness hits them. Their lights, sirens, and engine die...   And, out of the silence, a dark shape roars past -  "404,VETERAN COP,It can't be...    405,ROOKIE COP,The hell was that?!  406,VETERAN COP,"Oh boy. You're in for a show tonight, son.      "407,FOLEY,"Let's roll, they've spotted the Batman!409,FOLEY,I'm gonna do what Gordon never could410,BLAKE,What's that?    411,FOLEY,I'm gonna take down the Batman.  412,BLAKE,"Sir, what about the armed robbers?   Foley ignores him.     "413,SPOTTER, 414,SPOTTER, 415,FOLEY,Negative! Stay on the Batman!  416,BLAKE,But he's getting away!  417,FOLEY, 418,TV ANNOUNCER,"People aren't saying much - frankly, they're too busy - but all signs suggest that what we're  "419,CATWOMAN,"Well, what do you know? Catwoman opens the safe. Nothing inside. She frowns.      "420,BATMAN, WHAT WERE YOU STEALING?!   Shoeshine Man stares. Unafraid. Batman rips the computer from his pack. The screen reads:  421,APPLICATION COMPLETE,"  Blinding light and noise as police choppers descend - sirens everywhere. Batman grabs the USB drive from the laptop. He jumps on the Bat-Pod - pauses, taking in the sight of thousands of police, cars, choppers, dogs, closing in.     POLICE VOICE  "422,DAGGETT,After eight years he has to pick tonight...    423,STRYVER,"He's drawing the cops off Bane... Daggett watches, intrigued.      "424,FOLEY,How did you let him go?!  425,COP, 426,FOLEY,"And you don't?! We're not letting one nut with a bad attitude and some fancy gadgets run this town down, you hear me?!    "427,COP, 428,FOLEY, 429,FOLEY,"Like a rat in a trap, gentlemen... Foley reaches for a loudhailer. VARRROOOOM!! A noise from the alley that none of the cops have heard before...  "430,VETERAN COP,"You might have the wrong animal there, sir -   Spotlights smash on and a massive dark cyclone roars out of the alley, spinning the choppers sideways, dual rotor downdraft forcing all the cops to the ground. The Bat, now black, thunders up and over the entire Gotham PD. Blake slides up to Foley. Dry.    "431,BLAKE,Are you sure that was him? Foley looks at Blake. Thrusts the loudhailer at him.      432,ANNOUNCER, 433,STRYVER,"Bane says the Batman interfered, but the task was accomplished.  "434,DAGGETT,What about the men they arrested?    435,STRYVER,"He says, and I quote, they would die before talking.  "436,DAGGETT, 437,DAGGETT,And can we get some girls in here?  438,CATWOMAN,"Careful what you wish for. Catwoman grabs him, throws him across the room. His back slams against the wall - he draws a gun, but - WHACK! - Catwoman pins his wrist to the wall at shoulder height using the high heel of her boot. He whimpers as she leans in.  "439,CATWOMAN,Cat got your tongue? She plucks the gun from his trembling hand.  440,DAGGETT,You dumb bitch.    441,CATWOMAN,Nobody ever accused me of being dumb.     442,DAGGETT,Dumb to show up here tonight.  443,CATWOMAN,I want what you owe me -   Click - Stryver has a gun to her head.  444,DAGGETT,'I want' never gets...   Stryver looks appreciatively at Catwoman as she lowers her leg...  445,STRYVER,"Nice outfit...those heels make it tough to walk?   Catwoman digs her stiletto into his calf, hard. He screams.  "446,CATWOMAN,"I don't know, do they?   Catwoman spins, disarms Stryver, grabs Daggett.  "447,CATWOMAN,So where is it?  448,DAGGETT,Where's what?  449,CATWOMAN,The program. The 'Clean Slate'.  450,DAGGETT,"Oh, yeah - the ultimate tool for a master thief with a record. I don't have it. The Bodyguard bursts in, gun drawn. Catwoman, holding Daggett, spins, kicking the window with the point of her heel. The glass shatters. She pulls Daggett through the window. He screams - they drop...    "451,CATWOMAN,Where is it?    452,DAGGETT,The 'Clean Slate'? Type in a name and date of birth and within a couple hours that person ceases to exist in any database? Little too good to be true.  453,CATWOMAN,You're lying. Rykin Data took it to prototype stage -    454,DAGGETT,"That's why I bought them. But they had nothing. It was a gangland myth.   Catwoman leans back from Daggett, taking this in... Shapes drop onto the rooftop. Emerge from fire exits. They're not Daggett's bodyguards, these are Bane's men... Catwoman holds Daggett by the throat, threatening him.  "455,CATWOMAN,Stay back! They continue to approach. One of them screws a silencer onto his gun.  456,CATWOMAN,"I'm not bluffing!  VOICE They know...   All eyes search for the source of the voice. Catwoman spots it - a dark shape, crouched on the roof above: Batman.  "457,BATMAN,"They just don't care.   As the Mercenary with the silencer looks up, Catwoman leaps forward, grabs his gun. Batman drops into the middle of the fray, fighting back Mercenaries at Catwoman's back - she fires at one, clipping him, he drops. She spins aiming at another's head - Batman yanks her arm down, forcing her to miss the Mercenary. Batman takes him out with a kick.   "458,CATWOMAN,You've got to be kidding.  459,BATMAN,No guns. No killing.    460,CATWOMAN,"Where's the fun in that? As more mercenaries come out onto the roof, Batman runs for the far edge.  "461,BATMAN,"Come on! Catwoman follows, confused, as Batman leaps off the roof. She gets to the edge, pauses to look down into the alley - sees the black angular roof of the Bat, cockpit open. Shots impact around her - she leaps, landing hard, but gracefully on the back of the vehicle, slides into the cockpit. As the engines thunder into life, and the canopy hisses shut, taking bullets from above.    "462,CATWOMAN,My mother warned me about getting into cars with strange men -  463,BATMAN,"This isn't a car. Catwoman flinches as the Bat thunders into the sky, downdraft forcing the Mercenaries down onto the roof, all but one, who walks slowly across the roof, strong against the wind...Bane. He watches the Bat roar off into the night.      "464,CATWOMAN,See you around - Batman steps down after her.    465,BATMAN,You're welcome.  466,CATWOMAN,I had it under control.  63.    467,BATMAN,Those weren't street thugs - they were trained killers. I saved your life. In return I need to know what you did with Bruce Wayne's fingerprints. Catwoman looks at him. Considering.  468,CATWOMAN,Wayne wasn't kidding about a 'powerful friend'. I sold his prints to Daggett. For something that doesn't even exist.  469,BATMAN,I doubt many people get the better of you.  470,CATWOMAN,"Hey, when a girl's desperate...    "471,BATMAN,What were they going to do with them?  472,CATWOMAN,"I don't know. But Daggett seemed pretty interested in that mess at the stock market. Batman considers this. A police chopper sweeps past, searching. Batman turns to it. Then turns back.    "473,BATMAN,Miss Kyle -? But she is gone. So that's what that feels like.      474,ALFRED,Very inconspicuous. Shall I tell the neighbors you got yourself a new leaf-blower?  64.      475,WAYNE,"We bought all the neighbors. Alfred takes the cowl from him, then the cape, as they walk.  "476,ALFRED,"From the look of the television coverage, you seem to have your taste for wanton destruction back.  "477,WAYNE,478,ALFRED,Shouldn't the police be gathering the evidence?    479,WAYNE,They don't have the tools to analyze it.  480,ALFRED,They would if you gave them to them  -  481,WAYNE,One man's tool is another man's weapon.    482,ALFRED,"In your mind, perhaps. But there aren't many things you couldn't turn into a weapon.    "483,WAYNE,Alfred. Enough. The police weren't getting it done -  484,ALFRED,Perhaps they would've if you haven't made a sideshow of yourself.  485,WAYNE,Perhaps you're upset you were wrong.  486,ALFRED,Wrong?  65.      487,WAYNE,You thought I didn't have it in me. Alfred looks at him. Puts down the cape and cowl.  488,ALFRED,You don't. You lead a bloated police force on a merry chase with some fancy new toys from Fox. What about when you come up against him. What then?   Alfred points to the monitor - Wayne sees Bane killing...  489,WAYNE,"I'll fight harder, I always have.    "490,ALFRED,When you had something to fight for. What are you fighting for now? Not your life. Wayne moves to switch off the monitor. Alfred grabs his hand.  491,ALFRED,"Take a good look. At his speed, his ferocity, His training. I see the power of belief. Of the fanatic. I see the League of Shadows resurgent.  "492,WAYNE,You said he was excommunicated.    493,ALFRED,By R¯'s al Gh¯l. Who leads them  494,A U,now?  495,WAYNE,R¯'s al Gh¯l was the League of  496,A U,"Shadows. And I beat him. Bane's just a mercenary, and we have to find out what he's up to. Wayne plugs the USB in, hits keys. Text scrolls.    "497,WAYNE,"Trades of some kind. Coded... The screen blanks, a thumb print appears.  66.      "498,ALFRED,Is that -?  499,WAYNE,"Mine. Courtesy of Selina Kyle.   Wayne pulls out the USB, rises. Get this to Fox - he can crack the code and tell us what trades they were executing.   Alfred looks at Wayne. Takes the USB.    "500,ALFRED,I'll get this to Fox. But no more. Wayne hears his tone of voice. Turns to him.    501,ALFRED,I've sewn you up and set your bones...but I won't bury you. I've buried enough members of the Wayne family.    502,WAYNE,You'd abandon me?  503,ALFRED,You see only one end to your story. Leaving is all I have to make you understand: you aren't Batman anymore - you have to find another way. You used to talk about finishing. About life beyond that awful cave -    504,WAYNE,Rachel died knowing we'd decided to be together. That was my life beyond this cave and I can't just move on. She didn't. She couldn't.   Alfred considers this. Looks away.  505,ALFRED,What if he had? What if she wasn't intending to make a life with you?  506,WAYNE,"She was, I can't change that -  "507,ALFRED,"What if, before she died, she'd written a letter? Explaining that she'd chosen Harvey Dent over you? Wayne watches, confused, as the old man prepares to say -  "508,ALFRED,"And what if, to spare you pain...I'd burned that letter? Wayne stares at Alfred, shocked.  "509,WAYNE,Why would you say such a thing?  510,ALFRED,Because I have to make you understand.  511,WAYNE,You're lying.  512,ALFRED,Because you are as precious to me as you were to your own mother and father and I swore to them that I would protect you and I haven't.  513,WAYNE,You're lying!    514,ALFRED,"I've never lied to you. Except when I burned Rachel's letter. Wayne turns on the old man, furious.    "515,WAYNE,How dare you use Rachel to stop me!  516,ALFRED,"I'm using the truth, Master Wayne. Maybe it's time we all stopped trying to outsmart the truth and just let it have its day. I'm sorry.  68.      "517,WAYNE,"Sorry?! You expect to destroy my world, then shake hands?!  "518,ALFRED,No. I know what this means -  519,WAYNE,"What does it mean, Alfred?!  "520,ALFRED,It means your hatred. It means losing the person I've cared for ever since I heard his first cries echo through this house. But it might also mean saving your life. And that is more important.   Wayne looks at Alfred. Furious. Summons the worst thing to say and says it quietly and calmly.  521,WAYNE,"Goodbye, Alfred.    "522,ALFRED, 523,WAYNE,Alfred? But Alfred is gone.      524,FOX,Answering your own door?  525,WAYNE,Yes. Could you decode the trades on that drive?   Fox hands Wayne a newspaper - the main headline:  BATMAN BACK TO FOIL OR MASTERMIND STOCK RAID...    526,FOX,I didn't need to. Page three. Wayne turns the page:  WAYNE DOUBLES DOWN - AND LOSES...    527,FOX,"It seems you made a series of large put options on the futures exchange. Verified by thumb print. The options expired at midnight last night. Wayne looks up from the newspaper, reeling.  "528,FOX,"Long term we may be able to prove fraud, but for now...you're completely broke. And Wayne Enterprises is about to fall into the hands of John Daggett.  "529,WAYNE,The weapons - we can't let Daggett get his hands on Applied Sciences -  530,FOX,"Applied Sciences is shut up tight, and off the books. The energy project is a different story.  "531,WAYNE,Miranda Tate. We need to convince the board to get behind her. Let's show her the reactor -  532,FOX,We're meeting her there in thirty-five minutes. You better get dressed.  70.    533,MIRANDA,"You brought me out here to show me a rubbish dump, Mr. Fox?    "534,FOX,"Bear with me, Miss Tate. They arrive at a Portakabin and enter.      "535,FOX,"Keep your hands and feet inside the car at all times. He hits a button and the floor descends, Miranda is shocked as the office becomes an elevator into -      "536,MIRANDA,"This is it, isn't it?    "537,FOX,The reactor is beneath the river so that it could be instantly flooded in an event of a security breach.    538,MIRANDA,Is Bruce Wayne really that paranoid?  539,FOX,I'm gonna plead the fifth on that one. Miranda marvels as they step off the elevator. She spots a figure deep within: Bruce Wayne.    540,WAYNE,I thought you might like to see what your investment built.  71.    541,MIRANDA,"No radiation, no fossil fuels. Free, clean energy for an entire city.  "542,WAYNE,"If it worked. It doesn't. Wayne leads Miranda to the core. Two perpendicular rings of electromagnets suspend a bowling-ball-sized mass of metal. Wayne hits buttons - the ball glows, then dies to cold.  "543,WAYNE,"Ignition, yes. But no chain reaction.    "544,MIRANDA,You've built a lot of security around a damp squib. Nothing. About three years ago a Russian scientist published a paper on weaponized fusion reactions. One week later your reactor started 545,WAYNE,"Miranda, if it were operational, the danger to Gotham would be too great.    "546,MIRANDA,Would it make you feel better to know that the Russian scientist died in a plane crash six months ago?    